{"$schema":"https://json-schema.org/draft/2020-12/schema","$id":"https://enterprise-agent-system.invalid/contracts/control-plane/closure-record.v1.schema.json","title":"Enterprise Agent System Closure Record v1","type":"object","additionalProperties":false,"required":["schema_version","problem_id","source_subject_id","owner","state_machine","evidence","blockers","next_transition","human_owned","claims_not_proven"],"properties":{"schema_version":{"const":"enterprise-agent-system/closure-record/v1"},"problem_id":{"type":"string","pattern":"^PROB-[A-Z0-9][A-Z0-9._-]*$"},"source_subject_id":{"type":"string","pattern":"^SRC-"},"owner":{"type":"object","additionalProperties":false,"required":["repository","directory","issue"],"properties":{"repository":{"type":"string","pattern":"^[^/\\s]+/[^/\\s]+$"},"directory":{"type":"string","minLength":1},"issue":{"type":"string","pattern":"^https://github\\.com/[^/]+/[^/]+/issues/[0-9]+$"}}},"state_machine":{"type":"object","additionalProperties":false,"required":["current","next"],"properties":{"current":{"type":"string","minLength":1},"next":{"type":"string","minLength":1}}},"evidence":{"type":"array","minItems":1,"items":{"type":"object","additionalProperties":false,"required":["lane","required_lane","state","subject","claims_not_proven"],"properties":{"lane":{"enum":["SOURCE","CONTROL_PLANE","METHOD","RUNTIME_CONTRACT","TRANSPORT","IDENTITY","WORKFLOW","TASK","GATE","EFFECT","ARTIFACT","USER_OUTCOME","SHADOW","HUMAN_ADMIT","RELEASE"]},"required_lane":{"enum":["SOURCE","CONTROL_PLANE","METHOD","RUNTIME_CONTRACT","TRANSPORT","IDENTITY","WORKFLOW","TASK","GATE","EFFECT","ARTIFACT","USER_OUTCOME","SHADOW","HUMAN_ADMIT","RELEASE"]},"state":{"enum":["PASS","FAIL","ABSENT","NOT_IMPLEMENTED","NOT_EXERCISED","SKIPPED_BY_POLICY","STALE","BLOCKED","PARTIAL","HUMAN_ADMIT_REQUIRED","RELEASED"]},"subject":{"type":["object","null"],"additionalProperties":false,"properties":{"repository":{"type":"string"},"commit":{"type":"string","pattern":"^[0-9a-f]{40}$"},"tree":{"type":"string","pattern":"^[0-9a-f]{40}$"},"digest":{"type":"string","pattern":"^sha256:[0-9a-f]{64}$"}}},"claims_not_proven":{"type":"array","items":{"type":"string","minLength":1},"uniqueItems":true}}}},"blockers":{"type":"array","items":{"type":"object","additionalProperties":false,"required":["id","owner_issue","state"],"properties":{"id":{"type":"string","minLength":1},"owner_issue":{"type":"string","pattern":"^https://github\\.com/[^/]+/[^/]+/issues/[0-9]+$"},"state":{"enum":["OPEN","BLOCKED_BY_PREDECESSOR","HUMAN_ADMIT_REQUIRED"]}}}},"next_transition":{"type":"string","minLength":1},"human_owned":{"type":"array","minItems":1,"uniqueItems":true,"items":{"type":"string","minLength":1}},"claims_not_proven":{"type":"array","minItems":1,"uniqueItems":true,"items":{"type":"string","minLength":1}}}}
